text,type,tone,source
why did the musician get arrested he got in treble,joke,funny,joke_dataset
two guys walked into a bar the third one ducked,joke,funny,joke_dataset
why did the computer crash it had too many tabs open,joke,funny,joke_dataset
what do you call a potato in space spudnik,joke,funny,joke_dataset
why dont elephants hide in trees because they are very good at it,joke,funny,joke_dataset
why did the chicken hold a seance to get to the other side,joke,funny,joke_dataset
what do baby cows eat for lunch at the calfeteria,joke,funny,joke_dataset
what do you call a barbarian you cant see an invisigoth,joke,funny,joke_dataset
what did the car say to the valet i have been through a lot,joke,funny,joke_dataset
why did the baker have dirty hands because he kneaded dough,joke,funny,joke_dataset
what do you call a blind dinosaur a do you think he saw us,joke,funny,joke_dataset
what do you call a three humped camel pregnant,joke,funny,joke_dataset
what do you call a tiny amphibian a my newt,joke,funny,joke_dataset
why dont programmers like nature because of too many bugs,joke,funny,joke_dataset
what do you call a fake noodle an impasta,joke,funny,joke_dataset
why did the math book look sad because it had too many problems,joke,funny,joke_dataset
what do you call cheese that is not yours nacho cheese,joke,funny,joke_dataset
why did the student eat his homework because the teacher said it was a piece of cake,joke,funny,joke_dataset
why did the scarecrow win an award because he was outstanding in his field,joke,funny,joke_dataset
why dont scientists trust atoms because they make up everything,joke,funny,joke_dataset
success comes to those who keep trying despite failure,motivational,inspirational,quotes_dataset
you should focus on what you can control and let go of the rest,advice,serious,quotes_dataset
life can be painful but it teaches valuable lessons,motivational,emotional,quotes_dataset
the sky was painted with soft shades of orange and blue,description,descriptive,quotes_dataset
success comes to those who keep trying even after failure,motivational,inspirational,quotes_dataset
hard work beats talent when talent does not work hard,motivational,inspirational,quotes_dataset
believe in yourself even when no one else does,motivational,inspirational,quotes_dataset
every day is a new chance to improve yourself,motivational,inspirational,quotes_dataset
growth begins when you step out of your comfort zone,motivational,inspirational,quotes_dataset
taking small steps consistently leads to big results,advice,serious,quotes_dataset
do not rush decisions take time to think clearly,advice,serious,quotes_dataset
learn from your mistakes instead of repeating them,advice,serious,quotes_dataset
surround yourself with people who support your goals,advice,serious,quotes_dataset
life can feel overwhelming but it teaches valuable lessons,motivational,emotional,quotes_dataset
sometimes the hardest moments shape who you become,motivational,emotional,quotes_dataset
it hurts to let go but sometimes it is necessary to grow,motivational,emotional,quotes_dataset
memories can bring both happiness and pain at the same time,motivational,emotional,quotes_dataset
the silence often says more than words ever could,motivational,emotional,quotes_dataset
the sunset painted the sky with shades of orange and gold,description,descriptive,generated
the room was filled with soft light and quiet warmth,description,descriptive,generated
the city streets were crowded and full of energy,description,descriptive,generated
the mountain stood tall covered in mist and clouds,description,descriptive,generated
the ocean waves moved gently under the bright sky,description,descriptive,generated
hello how are you doing today,conversational,casual,conversation_dataset
i think you should take a break and relax for a while,advice,casual,conversation_dataset
that sounds like a really good idea to me,conversational,casual,conversation_dataset
i understand how you feel it can be tough sometimes,conversational,emotional,conversation_dataset
let me know if you need any help with that,conversational,casual,conversation_dataset
artificial intelligence allows machines to learn from data,informational,formal,wikipedia
machine learning is a method of improving performance using experience,informational,formal,wikipedia
data science involves analyzing data to extract useful insights,informational,formal,wikipedia
neural networks are inspired by the structure of the human brain,explanation,formal,wikipedia
algorithms are step by step procedures used to solve problems,explanation,formal,wikipedia
a database is a system used to store and manage information,informational,formal,wikipedia
cloud computing allows access to data and services over the internet,informational,formal,wikipedia
programming languages are used to communicate instructions to computers,explanation,formal,wikipedia
oh great another meeting that could have been an email,conversational,sarcastic,conversation_dataset
i absolutely love waiting in long lines it is my favorite activity,conversational,sarcastic,conversation_dataset
nothing feels better than your phone dying in the middle of something important,conversational,sarcastic,conversation_dataset
sure because everything always goes exactly as planned,conversational,sarcastic,conversation_dataset
what a surprise things did not work out the way you expected,conversational,sarcastic,conversation_dataset
discipline is more important than motivation when working towards goals,advice,serious,self_help
success requires consistent effort and patience over time,motivational,serious,self_help
failing is part of learning and should not be feared,motivational,serious,self_help
time management is essential for achieving productivity,advice,serious,self_help
setting clear goals helps in maintaining focus and direction,advice,serious,self_help
the rain fell steadily creating a calm and peaceful atmosphere,description,descriptive,generated
the forest was dense with tall trees and hidden paths,description,descriptive,generated
the night sky was filled with countless shining stars,description,descriptive,generated
the air felt cold and fresh as the wind moved gently,description,descriptive,generated
the old house stood quietly with a mysterious presence,description,descriptive,generated
sometimes life feels heavy and difficult to carry,motivational,emotional,quotes_dataset
there are days when everything seems to fall apart,motivational,emotional,quotes_dataset
holding on can be harder than letting go,motivational,emotional,quotes_dataset
pain often teaches lessons that comfort never could,motivational,emotional,quotes_dataset
even in darkness there is a chance for light,motivational,emotional,quotes_dataset
why did the bicycle fall over because it was too tired,joke,funny,joke_dataset
what do you call a sleeping bull a bulldozer,joke,funny,joke_dataset
why did the coffee file a police report it got mugged,joke,funny,joke_dataset
what do you call a fish wearing a bowtie sofishticated,joke,funny,joke_dataset
why did the golfer bring two pairs of pants in case he got a hole in one,joke,funny,joke_dataset
information technology involves the use of computers to manage data,informational,formal,wikipedia
software development is the process of creating applications and systems,informational,formal,wikipedia
databases store organized information for easy retrieval,informational,formal,wikipedia
cybersecurity focuses on protecting systems from digital attacks,informational,formal,wikipedia
networks allow devices to communicate and share resources,informational,formal,wikipedia
once upon a time a boy found a hidden path that changed his life,story,emotional,generated
a traveler wandered through the desert searching for meaning,story,serious,generated
the old man told stories of a world long forgotten,story,descriptive,generated
she opened the letter and her hands began to shake,story,emotional,generated
the village was silent as the storm approached,story,serious,generated
why did the tomato turn red because it saw the salad dressing,joke,funny,joke_dataset
what do you call a bear with no teeth a gummy bear,joke,funny,joke_dataset
why did the computer go to therapy it had too many issues,joke,funny,joke_dataset
i would love to help you with that just let me know what you need,conversational,casual,conversation_dataset
that sounds like a great plan you should definitely try it,conversational,casual,conversation_dataset
oh sure because everything always works perfectly the first time,conversational,sarcastic,conversation_dataset
i understand how difficult that must be for you,conversational,emotional,conversation_dataset
the product has a sleek design with a smooth metallic finish,description,descriptive,generated
the garden was filled with vibrant flowers and fresh scents,description,descriptive,generated
the building stood tall with glass walls reflecting sunlight,description,descriptive,generated
you should take time to rest and avoid burnout,advice,serious,self_help
try focusing on one task at a time to improve efficiency,advice,serious,self_help
it is important to stay consistent with your efforts,advice,formal,self_help
success is built on small efforts repeated daily,motivational,inspirational,quotes_dataset
never give up even when things feel impossible,motivational,inspirational,quotes_dataset
every setback is a step toward growth,motivational,inspirational,quotes_dataset
sometimes the hardest battles are fought silently,motivational,emotional,quotes_dataset
data analysis involves examining information to find patterns,informational,formal,wikipedia
artificial intelligence helps machines perform human like tasks,informational,formal,wikipedia
cloud systems allow users to store and access data remotely,informational,formal,wikipedia
a neural network processes data using layers of nodes,explanation,formal,wikipedia
algorithms solve problems using defined steps,explanation,formal,wikipedia
learning occurs when systems improve based on experience,explanation,formal,wikipedia
honestly this is exactly what i expected to happen,conversational,sarcastic,generated
great another problem just what we needed today,conversational,sarcastic,generated
the wind whispered softly through the trees,description,descriptive,generated
her eyes reflected a deep sense of sadness,description,emotional,generated
you need to stay focused if you want better results,advice,serious,self_help
consistency matters more than intensity in the long run,motivational,serious,self_help
failure teaches lessons that success cannot,motivational,serious,self_help
once there was a girl who chased her dreams fearlessly,story,inspirational,generated
the journey was long but it shaped who he became,story,inspirational,generated
once upon a time a girl found a hidden door in her house,story,emotional,generated
a man traveled across mountains searching for purpose,story,serious,generated
the night was silent as the village waited for dawn,story,descriptive,generated
he opened the book and discovered a forgotten world,story,inspirational,generated
she walked alone but never felt truly lost,story,emotional,generated
the storm grew stronger as the ship moved forward,story,serious,generated
a child dreamed of flying beyond the clouds,story,inspirational,generated
the forest whispered secrets to those who listened,story,descriptive,generated
he chased his goals despite constant failure,story,inspirational,generated
the journey changed him in ways he never expected,story,serious,generated
,,,
why did the scarecrow get promoted because he was outstanding in his field,joke,funny,joke_dataset
what do you call fake spaghetti an impasta,joke,funny,joke_dataset
why did the student eat his homework because it was a piece of cake,joke,funny,joke_dataset
what do you call a fish with no eyes fsh,joke,funny,joke_dataset
what do you call a cow with no legs ground beef,joke,funny,joke_dataset
hey how are you doing today,conversational,casual,conversation_dataset
i think you should give it a try,conversational,casual,conversation_dataset
i understand what you are going through,conversational,emotional,conversation_dataset
that must have been really difficult for you,conversational,emotional,conversation_dataset
oh great another problem just what we needed,conversational,sarcastic,generated
sure because everything always works perfectly,conversational,sarcastic,generated
yeah that is exactly what i expected to happen,conversational,sarcastic,generated
let me know if you need any help,conversational,casual,conversation_dataset
i will get back to you as soon as possible,conversational,formal,conversation_dataset
the room was filled with warm golden light,description,descriptive,generated
the mountains stood tall covered in mist,description,descriptive,generated
the river flowed quietly under the bridge,description,descriptive,generated
her voice was soft yet full of emotion,description,emotional,generated
the sky turned shades of orange and pink,description,descriptive,generated
the city was alive with noise and movement,description,descriptive,generated
his expression showed deep sadness,description,emotional,generated
the wind moved gently through the trees,description,descriptive,generated
the house looked old but full of stories,description,descriptive,generated
the air felt cold and refreshing,description,descriptive,generated
you should focus on your priorities,advice,serious,self_help
take small steps instead of rushing everything,advice,serious,self_help
try to stay consistent with your efforts,advice,serious,self_help
it is important to maintain balance in life,advice,formal,self_help
avoid distractions if you want better results,advice,serious,self_help
learn to say no when necessary,advice,serious,self_help
take breaks to avoid burnout,advice,casual,self_help
listen carefully before making decisions,advice,formal,self_help
do not ignore your mental health,advice,serious,self_help
focus on progress not perfection,advice,casual,self_help
success comes to those who keep trying,motivational,inspirational,quotes_dataset
never give up even when it gets hard,motivational,inspirational,quotes_dataset
every failure is a lesson in disguise,motivational,inspirational,quotes_dataset
believe in yourself and your journey,motivational,inspirational,quotes_dataset
hard work always pays off eventually,motivational,inspirational,quotes_dataset
sometimes life feels overwhelming but you must keep going,motivational,emotional,quotes_dataset
growth happens outside your comfort zone,motivational,inspirational,quotes_dataset
your mindset determines your success,motivational,serious,quotes_dataset
keep pushing even when you feel tired,motivational,emotional,quotes_dataset
small progress is still progress,motivational,casual,quotes_dataset
artificial intelligence enables machines to learn,informational,formal,wikipedia
machine learning improves systems through data,informational,formal,wikipedia
data science focuses on extracting insights,informational,formal,wikipedia
cloud computing allows remote data access,informational,formal,wikipedia
cybersecurity protects systems from threats,informational,formal,wikipedia
databases store structured information,informational,formal,wikipedia
networks connect devices for communication,informational,formal,wikipedia
programming languages control computer behavior,informational,formal,wikipedia
software development builds applications,informational,formal,wikipedia
big data refers to large complex datasets,informational,formal,wikipedia
algorithms are step by step problem solving methods,explanation,formal,wikipedia
neural networks mimic the human brain structure,explanation,formal,wikipedia
deep learning uses layered models for predictions,explanation,formal,wikipedia
training improves model accuracy over time,explanation,formal,wikipedia
features are important inputs for models,explanation,formal,wikipedia
classification assigns labels to data,explanation,formal,wikipedia
regression predicts continuous values,explanation,formal,wikipedia
clustering groups similar data points,explanation,formal,wikipedia
validation ensures model reliability,explanation,formal,wikipedia
optimization improves model performance,explanation,formal,wikipedia
honestly this is exactly what i expected,conversational,sarcastic,generated
amazing another delay just perfect,conversational,sarcastic,generated
yeah because nothing ever goes wrong right,conversational,sarcastic,generated
this is clearly the best possible outcome,conversational,sarcastic,generated
sure lets pretend everything is fine,conversational,sarcastic,generated
a young boy discovered a hidden cave behind his house,story,descriptive,generated
she followed the sound of music into the unknown forest,story,emotional,generated
the old diary revealed secrets from a forgotten past,story,serious,generated
he risked everything to chase his dream,story,inspirational,generated
the journey was long but filled with lessons,story,serious,generated
she stood alone but felt stronger than ever,story,emotional,generated
the city lights guided him through the dark night,story,descriptive,generated
he learned that failure was not the end,story,inspirational,generated
the silence of the room felt overwhelming,story,emotional,generated
they built a life from nothing but hope,story,inspirational,generated
the waves crashed as the ship sailed forward,story,descriptive,generated
she smiled even when things were falling apart,story,emotional,generated
the stranger carried a mysterious message,story,serious,generated
he never imagined his decision would change everything,story,serious,generated
the child laughed without a care in the world,story,descriptive,generated
why did the computer go to the doctor it caught a virus,joke,funny,joke_dataset
what do you call a dinosaur with an extensive vocabulary a thesaurus,joke,funny,joke_dataset
why did the golfer bring extra socks in case of a hole in one,joke,funny,joke_dataset
what do you call a belt made of watches a waist of time,joke,funny,joke_dataset
why did the cookie go to the hospital because it felt crummy,joke,funny,joke_dataset
what do you call a dog magician a labracadabrador,joke,funny,joke_dataset
why did the calendar get stressed it had too many dates,joke,funny,joke_dataset
what do you call a snowman with a six pack an abdominal snowman,joke,funny,joke_dataset
why did the coffee feel sad it got roasted,joke,funny,joke_dataset
what do you call a lazy kangaroo a pouch potato,joke,funny,joke_dataset
why did the computer sit alone it had no connections,joke,funny,joke_dataset
what do you call a singing laptop a dell,joke,funny,joke_dataset
why did the banana go to the doctor it was not peeling well,joke,funny,joke_dataset
what do you call a broken pencil pointless,joke,funny,joke_dataset
why did the phone need glasses it lost its contacts,joke,funny,joke_dataset
hello what can i help you with today,conversational,formal,conversation_dataset
i think that sounds like a great idea,conversational,casual,conversation_dataset
you should definitely consider trying it,conversational,casual,conversation_dataset
i understand why you feel that way,conversational,emotional,conversation_dataset
that must have been really frustrating,conversational,emotional,conversation_dataset
oh wow another delay what a surprise,conversational,sarcastic,generated
yeah because everything always works perfectly right,conversational,sarcastic,generated
sure lets just ignore the problem,conversational,sarcastic,generated
i will look into it and get back to you,conversational,formal,conversation_dataset
please let me know if you need further assistance,conversational,formal,conversation_dataset
thanks for sharing that with me,conversational,casual,conversation_dataset
i appreciate your effort on this,conversational,casual,conversation_dataset
this situation sounds really tough,conversational,emotional,conversation_dataset
i completely understand your concern,conversational,formal,conversation_dataset
great just what we needed another issue,conversational,sarcastic,generated
the garden was filled with colorful blooming flowers,description,descriptive,generated
the sky turned dark as clouds gathered slowly,description,descriptive,generated
the air smelled fresh after the rain,description,descriptive,generated
his voice carried a tone of deep sadness,description,emotional,generated
the building had a modern glass exterior,description,descriptive,generated
the room felt warm and welcoming,description,descriptive,generated
her eyes reflected a sense of hope,description,emotional,generated
the street was busy with people and noise,description,descriptive,generated
the wind was strong and cold,description,descriptive,generated
the house looked quiet and abandoned,description,descriptive,generated
the sunset created a beautiful horizon,description,descriptive,generated
the silence was both peaceful and unsettling,description,emotional,generated
the lights flickered in the dark hallway,description,descriptive,generated
the forest was dense and mysterious,description,descriptive,generated
the ocean waves moved rhythmically,description,descriptive,generated
you should plan your tasks carefully,advice,serious,self_help
focus on what truly matters in your life,advice,serious,self_help
try to maintain a healthy routine,advice,serious,self_help
it is important to stay disciplined,advice,formal,self_help
avoid unnecessary distractions,advice,serious,self_help
take time to reflect on your decisions,advice,formal,self_help
learn from your past experiences,advice,serious,self_help
do not rush important choices,advice,serious,self_help
keep your goals realistic and achievable,advice,serious,self_help
you should stay consistent with your efforts,advice,casual,self_help
always prioritize your well being,advice,serious,self_help
practice patience in difficult situations,advice,formal,self_help
listen more and speak less,advice,serious,self_help
try to improve a little every day,advice,casual,self_help
be mindful of your time and energy,advice,serious,self_help
believe in your ability to succeed,motivational,inspirational,quotes_dataset
never stop pushing forward,motivational,inspirational,quotes_dataset
success is built through persistence,motivational,inspirational,quotes_dataset
your efforts will pay off eventually,motivational,inspirational,quotes_dataset
every step counts no matter how small,motivational,inspirational,quotes_dataset
sometimes life feels heavy but you must continue,motivational,emotional,quotes_dataset
challenges are opportunities in disguise,motivational,inspirational,quotes_dataset
stay strong even during tough times,motivational,emotional,quotes_dataset
your mindset shapes your reality,motivational,serious,quotes_dataset
keep working even when you feel tired,motivational,emotional,quotes_dataset
growth requires stepping outside comfort,motivational,inspirational,quotes_dataset
you are capable of more than you think,motivational,inspirational,quotes_dataset
difficult times build stronger people,motivational,emotional,quotes_dataset
progress takes time and patience,motivational,serious,quotes_dataset
keep moving forward no matter what,motivational,inspirational,quotes_dataset
information systems manage and process data,informational,formal,wikipedia
artificial intelligence simulates human thinking,informational,formal,wikipedia
machine learning improves through experience,informational,formal,wikipedia
data analysis helps identify patterns,informational,formal,wikipedia
cloud computing enables remote storage,informational,formal,wikipedia
networks allow communication between devices,informational,formal,wikipedia
databases organize structured information,informational,formal,wikipedia
software engineering develops applications,informational,formal,wikipedia
cybersecurity protects digital systems,informational,formal,wikipedia
big data involves large scale datasets,informational,formal,wikipedia
programming enables automation of tasks,informational,formal,wikipedia
systems operate based on defined logic,informational,formal,wikipedia
data visualization presents insights clearly,informational,formal,wikipedia
computers process information efficiently,informational,formal,wikipedia
technology evolves rapidly over time,informational,formal,wikipedia
algorithms provide step by step solutions,explanation,formal,wikipedia
models learn patterns from training data,explanation,formal,wikipedia
features represent input variables in models,explanation,formal,wikipedia
classification groups data into categories,explanation,formal,wikipedia
regression predicts continuous outcomes,explanation,formal,wikipedia
clustering identifies similar data points,explanation,formal,wikipedia
training improves prediction accuracy,explanation,formal,wikipedia
validation ensures model generalization,explanation,formal,wikipedia
optimization enhances model performance,explanation,formal,wikipedia
neural networks process layered information,explanation,formal,wikipedia
deep learning uses multiple layers for learning,explanation,formal,wikipedia
parameters define model behavior,explanation,formal,wikipedia
data preprocessing improves input quality,explanation,formal,wikipedia
evaluation measures model performance,explanation,formal,wikipedia
learning occurs through repeated exposure,explanation,formal,wikipedia
a boy found a mysterious key that opened unknown doors,story,descriptive,generated
she walked through the rain thinking about her past,story,emotional,generated
the old castle stood silent under the dark sky,story,descriptive,generated
he chased his dreams despite constant rejection,story,inspirational,generated
the road ahead was uncertain but full of hope,story,inspirational,generated
she read the letter and tears filled her eyes,story,emotional,generated
