text,type,tone,source
the traveler never stopped exploring new places,story,serious,generated
the wind howled as the night grew darker,story,descriptive,generated
he learned that patience was his greatest strength,story,inspirational,generated
the silence of the room felt heavy and deep,story,emotional,generated
she took a step forward and changed her destiny,story,inspirational,generated
the story began with a single unexpected moment,story,serious,generated
the forest was alive with hidden sounds,story,descriptive,generated
he realized that failure was part of success,story,inspirational,generated
the journey shaped him into a stronger person,story,serious,generated
why did the laptop go to therapy it had too many issues,joke,funny,joke_dataset
what do you call a cow that plays guitar a moo sician,joke,funny,joke_dataset
why did the clock get kicked out it tocked too much,joke,funny,joke_dataset
what do you call a nervous javelin thrower shakespeare,joke,funny,joke_dataset
why did the computer break up it had too many bugs,joke,funny,joke_dataset
what do you call a bear in the rain a drizzly bear,joke,funny,joke_dataset
why did the phone feel lonely it had no signal,joke,funny,joke_dataset
what do you call a fish that practices medicine a sturgeon,joke,funny,joke_dataset
why did the light bulb fail it was not bright enough,joke,funny,joke_dataset
what do you call a cold dog a chili dog,joke,funny,joke_dataset
why did the computer freeze it left its windows open,joke,funny,joke_dataset
what do you call a duck that steals a robber ducky,joke,funny,joke_dataset
why did the car stop it ran out of gas,joke,funny,joke_dataset
what do you call a fake doctor a quack,joke,funny,joke_dataset
why did the orange stop rolling it ran out of juice,joke,funny,joke_dataset
hello i hope you are doing well today,conversational,casual,conversation_dataset
that sounds like something worth trying,conversational,casual,conversation_dataset
i completely understand your situation,conversational,emotional,conversation_dataset
that must have been really challenging,conversational,emotional,conversation_dataset
oh great another issue just perfect,conversational,sarcastic,generated
yeah because everything always goes smoothly right,conversational,sarcastic,generated
sure nothing could possibly go wrong here,conversational,sarcastic,generated
i will get back to you shortly,conversational,formal,conversation_dataset
please allow me to assist you with that,conversational,formal,conversation_dataset
thanks for letting me know about this,conversational,casual,conversation_dataset
i appreciate your feedback on this matter,conversational,formal,conversation_dataset
this sounds really difficult to handle,conversational,emotional,conversation_dataset
i can see why you feel that way,conversational,emotional,conversation_dataset
great just what we needed another delay,conversational,sarcastic,generated
i will make sure to look into this issue,conversational,formal,conversation_dataset
the sky was clear with a bright blue color,description,descriptive,generated
the room had a calm and peaceful atmosphere,description,descriptive,generated
the forest was dark and full of mystery,description,descriptive,generated
her voice carried a soft emotional tone,description,emotional,generated
the building looked modern and elegant,description,descriptive,generated
the street was crowded with moving cars,description,descriptive,generated
his expression showed deep concern,description,emotional,generated
the ocean looked vast and endless,description,descriptive,generated
the air felt fresh after the rain,description,descriptive,generated
the lights glowed softly in the distance,description,descriptive,generated
the silence created an eerie feeling,description,emotional,generated
the mountains stood tall and strong,description,descriptive,generated
the environment felt lively and energetic,description,descriptive,generated
the wind moved quietly through the trees,description,descriptive,generated
the house appeared old and abandoned,description,descriptive,generated
you should stay focused on your goals,advice,serious,self_help
take small consistent steps every day,advice,serious,self_help
try to avoid unnecessary distractions,advice,serious,self_help
it is important to manage your time wisely,advice,formal,self_help
learn to stay calm under pressure,advice,serious,self_help
always think before making decisions,advice,formal,self_help
focus on improving yourself gradually,advice,casual,self_help
stay disciplined even when it is hard,advice,serious,self_help
set clear priorities for your tasks,advice,formal,self_help
take breaks when needed to recharge,advice,casual,self_help
learn from your mistakes regularly,advice,serious,self_help
keep your expectations realistic,advice,serious,self_help
be patient with your progress,advice,formal,self_help
stay consistent with your efforts,advice,casual,self_help
believe in yourself no matter what,motivational,inspirational,quotes_dataset
never give up on your dreams,motivational,inspirational,quotes_dataset
success takes time and effort,motivational,serious,quotes_dataset
keep moving forward despite obstacles,motivational,inspirational,quotes_dataset
every failure is a learning opportunity,motivational,inspirational,quotes_dataset
sometimes life feels overwhelming but you must continue,motivational,emotional,quotes_dataset
growth happens through challenges,motivational,inspirational,quotes_dataset
keep pushing even when tired,motivational,emotional,quotes_dataset
small steps lead to big changes,motivational,inspirational,quotes_dataset
you are capable of achieving great things,motivational,inspirational,quotes_dataset
difficult times build strength,motivational,emotional,quotes_dataset
stay positive during tough moments,motivational,emotional,quotes_dataset
progress requires patience,motivational,serious,quotes_dataset
never stop improving yourself,motivational,inspirational,quotes_dataset
data science involves analyzing large datasets,informational,formal,wikipedia
machine learning improves systems automatically,informational,formal,wikipedia
artificial intelligence simulates human intelligence,informational,formal,wikipedia
cloud computing enables remote access,informational,formal,wikipedia
cybersecurity protects digital information,informational,formal,wikipedia
databases store organized data efficiently,informational,formal,wikipedia
networks connect systems for communication,informational,formal,wikipedia
big data handles complex data systems,informational,formal,wikipedia
programming allows automation of tasks,informational,formal,wikipedia
systems operate using defined logic,informational,formal,wikipedia
data visualization helps interpret data,informational,formal,wikipedia
computers process information quickly,informational,formal,wikipedia
digital systems rely on structured data,informational,formal,wikipedia
algorithms define steps to solve problems,explanation,formal,wikipedia
models learn patterns from input data,explanation,formal,wikipedia
features represent key data attributes,explanation,formal,wikipedia
classification categorizes data into groups,explanation,formal,wikipedia
regression predicts numerical outcomes,explanation,formal,wikipedia
training improves model performance,explanation,formal,wikipedia
validation ensures model accuracy,explanation,formal,wikipedia
optimization enhances efficiency,explanation,formal,wikipedia
deep learning uses complex structures,explanation,formal,wikipedia
parameters control model behavior,explanation,formal,wikipedia
preprocessing improves input data quality,explanation,formal,wikipedia
evaluation measures effectiveness,explanation,formal,wikipedia
learning improves with experience,explanation,formal,wikipedia
he opened the door and discovered a hidden world,story,descriptive,generated
she felt a deep sense of loss as she read the message,story,emotional,generated
the journey was difficult but full of growth,story,inspirational,generated
the silence in the room made him uneasy,story,serious,generated
they walked together under the glowing night sky,story,descriptive,generated
she overcame her fears and moved forward,story,inspirational,generated
the old house held memories of the past,story,emotional,generated
he realized his mistake too late,story,serious,generated
the wind carried whispers of forgotten times,story,descriptive,generated
she chose courage over fear,story,inspirational,generated
why did the pencil break it could not handle the pressure,joke,funny,joke_dataset
what do you call a lazy lion a lie in,joke,funny,joke_dataset
why did the computer get cold it left its windows open,joke,funny,joke_dataset
what do you call a fast duck a quick quack,joke,funny,joke_dataset
why did the cookie cry it felt crummy,joke,funny,joke_dataset
what do you call a smart dog a lab genius,joke,funny,joke_dataset
why did the phone go to school to improve its connections,joke,funny,joke_dataset
what do you call a cold elephant an ice pachyderm,joke,funny,joke_dataset
why did the chair break it could not support itself,joke,funny,joke_dataset
what do you call a musical fish a bass player,joke,funny,joke_dataset
i think you should give it some time,conversational,casual,conversation_dataset
that must have been really hard for you,conversational,emotional,conversation_dataset
oh great another problem just perfect,conversational,sarcastic,generated
i will handle this issue for you,conversational,formal,conversation_dataset
thanks for letting me know,conversational,casual,conversation_dataset
i understand your frustration,conversational,emotional,conversation_dataset
sure because everything always works fine,conversational,sarcastic,generated
please provide more details,conversational,formal,conversation_dataset
i appreciate your effort,conversational,casual,conversation_dataset
this situation sounds difficult,conversational,emotional,conversation_dataset
the sky was filled with dark clouds,description,descriptive,generated
the room felt warm and comfortable,description,descriptive,generated
her voice carried sadness,description,emotional,generated
the forest looked mysterious and deep,description,descriptive,generated
the street was crowded and noisy,description,descriptive,generated
his expression showed fear,description,emotional,generated
the building was tall and modern,description,descriptive,generated
the air felt fresh and cool,description,descriptive,generated
the silence was heavy,description,emotional,generated
the ocean looked endless,description,descriptive,generated
take small steps every day,advice,serious,self_help
try to stay consistent,advice,casual,self_help
it is important to plan ahead,advice,formal,self_help
avoid distractions while working,advice,serious,self_help
learn from your mistakes,advice,serious,self_help
take breaks when needed,advice,casual,self_help
be patient with yourself,advice,formal,self_help
stay disciplined in your routine,advice,serious,self_help
focus on improvement not perfection,advice,casual,self_help
never stop believing in yourself,motivational,inspirational,quotes_dataset
success comes through hard work,motivational,serious,quotes_dataset
keep going even when it is hard,motivational,emotional,quotes_dataset
growth takes time and effort,motivational,serious,quotes_dataset
every step matters,motivational,inspirational,quotes_dataset
you are stronger than you think,motivational,inspirational,quotes_dataset
failure teaches valuable lessons,motivational,inspirational,quotes_dataset
stay positive during tough times,motivational,emotional,quotes_dataset
progress is still progress,motivational,casual,quotes_dataset
never give up,motivational,inspirational,quotes_dataset
artificial intelligence enables automation,informational,formal,wikipedia
machine learning improves systems over time,informational,formal,wikipedia
data science analyzes patterns,informational,formal,wikipedia
cloud computing allows remote storage,informational,formal,wikipedia
cybersecurity protects systems,informational,formal,wikipedia
databases organize information,informational,formal,wikipedia
networks connect devices,informational,formal,wikipedia
software development builds programs,informational,formal,wikipedia
big data involves large datasets,informational,formal,wikipedia
programming enables automation,informational,formal,wikipedia
algorithms solve problems step by step,explanation,formal,wikipedia
models learn from data,explanation,formal,wikipedia
features represent input data,explanation,formal,wikipedia
classification groups data,explanation,formal,wikipedia
regression predicts values,explanation,formal,wikipedia
clustering finds patterns,explanation,formal,wikipedia
training improves accuracy,explanation,formal,wikipedia
validation checks performance,explanation,formal,wikipedia
neural networks process inputs,explanation,formal,wikipedia
the young artist painted his dreams onto the canvas,story,descriptive,generated
she held the letter tightly as memories flooded back,story,emotional,generated
the journey ahead was uncertain but full of hope,story,inspirational,generated
he stood silently watching the sun set behind the hills,story,descriptive,generated
the decision he made would change everything,story,serious,generated
she faced her fears and chose to move forward,story,inspirational,generated
the quiet room echoed with unspoken words,story,emotional,generated
the path through the forest was long and mysterious,story,descriptive,generated
he learned the importance of patience and resilience,story,inspirational,generated
the night felt heavy with tension,story,serious,generated
why did the computer bring a jacket it had a virus,joke,funny,joke_dataset
what do you call a lazy snake a slow python,joke,funny,joke_dataset
why did the tomato blush it saw the salad dressing,joke,funny,joke_dataset
what do you call a fish that can sing a tuna,joke,funny,joke_dataset
why did the laptop go to school to improve its skills,joke,funny,joke_dataset
what do you call a funny robot a laugh bot,joke,funny,joke_dataset
why did the book go to therapy it had too many issues,joke,funny,joke_dataset
what do you call a cold bird a chill eagle,joke,funny,joke_dataset
why did the keyboard break it lost control,joke,funny,joke_dataset
what do you call a smart cat a purr fessor,joke,funny,joke_dataset
hey i hope you are having a good day,conversational,casual,conversation_dataset
oh wow another issue how surprising,conversational,sarcastic,generated
yeah because everything always works perfectly,conversational,sarcastic,generated
sure lets just pretend nothing is wrong,conversational,sarcastic,generated
i will get back to you soon,conversational,formal,conversation_dataset
please allow me to assist you,conversational,formal,conversation_dataset
thank you for your understanding,conversational,formal,conversation_dataset
the garden was filled with bright colorful flowers,description,descriptive,generated
the sky was clear and blue,description,descriptive,generated
her voice carried a sense of sadness,description,emotional,generated
the building looked modern and sleek,description,descriptive,generated
his expression showed worry,description,emotional,generated
the wind was cold and refreshing,description,descriptive,generated
the ocean stretched endlessly,description,descriptive,generated
the silence was uncomfortable,description,emotional,generated
the house looked old and quiet,description,descriptive,generated
you should stay consistent with your work,advice,serious,self_help
take small steps toward your goals,advice,serious,self_help
try to stay focused on what matters,advice,casual,self_help
it is important to manage your time,advice,formal,self_help
learn from your experiences,advice,serious,self_help
focus on improvement every day,advice,casual,self_help
never stop believing in your dreams,motivational,inspirational,quotes_dataset
success requires patience and effort,motivational,serious,quotes_dataset
growth comes from challenges,motivational,inspirational,quotes_dataset
stay positive even during tough times,motivational,emotional,quotes_dataset
progress is progress no matter how small,motivational,casual,quotes_dataset
never give up on your goals,motivational,inspirational,quotes_dataset
artificial intelligence helps automate tasks,informational,formal,wikipedia
cloud computing enables remote data access,informational,formal,wikipedia
networks connect devices globally,informational,formal,wikipedia
big data involves large scale processing,informational,formal,wikipedia
programming allows system control,informational,formal,wikipedia
models learn patterns from data,explanation,formal,wikipedia
features represent important variables,explanation,formal,wikipedia
classification groups similar data,explanation,formal,wikipedia
regression predicts numerical values,explanation,formal,wikipedia
clustering identifies patterns,explanation,formal,wikipedia
neural networks process layered data,explanation,formal,wikipedia
everything is going exactly as planned obviously,conversational,sarcastic,generated
amazing another unexpected issue just great,conversational,sarcastic,generated
sure this is definitely the best outcome,conversational,sarcastic,generated
great timing for another problem,conversational,sarcastic,generated
the boy walked alone through the quiet village,story,descriptive,generated
she held onto hope despite everything falling apart,story,emotional,generated
the journey was long but meaningful,story,inspirational,generated
he faced his fears and kept moving forward,story,inspirational,generated
the silence around them felt heavy and tense,story,serious,generated
the forest was deep and full of hidden paths,story,descriptive,generated
she smiled through the pain and continued,story,emotional,generated
the road ahead was uncertain yet exciting,story,inspirational,generated
he realized that every failure taught him something,story,serious,generated
the night sky shimmered with countless stars,story,descriptive,generated
why did the computer go to sleep it was tired,joke,funny,joke_dataset
what do you call a funny mountain hillarious,joke,funny,joke_dataset
why did the phone get promoted it had good connections,joke,funny,joke_dataset
why did the student bring a ladder to school to reach high grades,joke,funny,joke_dataset
what do you call a fish without eyes fsh,joke,funny,joke_dataset
why did the book stay sad it had too many problems,joke,funny,joke_dataset
what do you call a smart bird a wise owl,joke,funny,joke_dataset
why did the computer break it had too many errors,joke,funny,joke_dataset
what do you call a lazy dog a nap hound,joke,funny,joke_dataset
hey i just wanted to check how you are doing,conversational,casual,conversation_dataset
that sounds like a great idea honestly,conversational,casual,conversation_dataset
i understand how you feel about this,conversational,emotional,conversation_dataset
sure nothing could go wrong here at all,conversational,sarcastic,generated
i will look into this and get back to you,conversational,formal,conversation_dataset
please let me know if you need assistance,conversational,formal,conversation_dataset
thank you for your patience,conversational,formal,conversation_dataset
the sky was painted with shades of orange and pink,description,descriptive,generated
the room felt warm and inviting,description,descriptive,generated
her voice carried deep emotion,description,emotional,generated
the forest looked dark and mysterious,description,descriptive,generated
the street was full of life and energy,description,descriptive,generated
his face showed signs of worry,description,emotional,generated
the wind felt cold against his skin,description,descriptive,generated
the silence created tension in the room,description,emotional,generated
the ocean stretched endlessly beyond the horizon,description,descriptive,generated
avoid distractions when working,advice,serious,self_help
learn from your mistakes and improve,advice,serious,self_help
take breaks when necessary,advice,casual,self_help
keep pushing forward no matter what,motivational,inspirational,quotes_dataset
growth comes from facing challenges,motivational,inspirational,quotes_dataset
every small step matters,motivational,inspirational,quotes_dataset
data science helps extract useful insights,informational,formal,wikipedia
machine learning improves system performance,informational,formal,wikipedia
cloud computing allows remote data storage,informational,formal,wikipedia
big data involves processing large datasets,informational,formal,wikipedia
features represent key inputs,explanation,formal,wikipedia
clustering identifies patterns in data,explanation,formal,wikipedia
training improves model accuracy,explanation,formal,wikipedia
validation ensures reliability,explanation,formal,wikipedia
optimization improves performance,explanation,formal,wikipedia
he walked into the unknown with courage in his heart,story,inspirational,generated
she remembered the past and felt a wave of emotions,story,emotional,generated
the village remained silent under the dark sky,story,descriptive,generated
he made a choice that changed his future forever,story,serious,generated
the journey ahead was filled with uncertainty,story,serious,generated
she believed in herself despite all doubts,story,inspirational,generated
the wind whispered through the empty streets,story,descriptive,generated
he learned that patience leads to success,story,inspirational,generated
the night felt long and heavy,story,emotional,generated
the path through the forest was unclear,story,descriptive,generated
what do you call a funny cat a purr comedian,joke,funny,joke_dataset
why did the computer feel cold it left its windows open,joke,funny,joke_dataset
what do you call a fish that works a job a worker fish,joke,funny,joke_dataset
why did the student stay calm he was well prepared,joke,funny,joke_dataset
what do you call a happy dog a joyful pup,joke,funny,joke_dataset
why did the chair feel tired it had too much weight,joke,funny,joke_dataset
what do you call a smart fox a clever fox,joke,funny,joke_dataset
why did the phone go silent it lost its signal,joke,funny,joke_dataset
what do you call a fast bird a speed hawk,joke,funny,joke_dataset
hey how have you been lately,conversational,casual,conversation_dataset
that sounds like something you should try,conversational,casual,conversation_dataset
that must have been really stressful,conversational,emotional,conversation_dataset
oh great another issue just what we needed,conversational,sarcastic,generated
yeah because everything always goes perfectly,conversational,sarcastic,generated
please let me know how i can help,conversational,formal,conversation_dataset
thank you for your cooperation,conversational,formal,conversation_dataset
the sky looked calm and clear,description,descriptive,generated
her voice carried deep sadness,description,emotional,generated
the forest appeared dark and mysterious,description,descriptive,generated
the street was busy and loud,description,descriptive,generated
the building looked tall and modern,description,descriptive,generated
the silence created tension,description,emotional,generated
try to stay focused on your priorities,advice,casual,self_help
data science helps analyze large datasets,informational,formal,wikipedia
databases organize information efficiently,informational,formal,wikipedia
software engineering builds applications,informational,formal,wikipedia
big data involves processing large information,informational,formal,wikipedia
features represent key variables,explanation,formal,wikipedia
training improves accuracy over time,explanation,formal,wikipedia
neural networks process data layers,explanation,formal,wikipedia
